fraction,name,sketch_kmers,genome_fraction
0.350877192982,"NC_008094.1 Y73 sarcoma virus, complete genome",0,2.77127298425e-05
0.342105263158,"NC_005947.1 Avian endogenous retrovirus EAV-HP, complete genome",0,1.80132743976e-05
0.228571428571,"NC_001866.1 Avian myelocytomatosis virus, complete genome",0,1.1085091937e-05
0.203703703704,"NC_001408.1 Avian leukosis virus - RSA, complete genome",0,1.52420014133e-05
0.16,"NC_001403.1 Fujinami sarcoma virus, complete genome",0,1.1085091937e-05
0.0666666666667,"NC_015116.1 Avian leukemia virus isolate SCDY1, complete genome",0,6.92818246061e-06
