fraction,name,sketch_kmers,genome_fraction
0.631578947368,"NC_005947.1 Avian endogenous retrovirus EAV-HP, complete genome",0,3.89902816723e-05
0.395348837209,"NC_001407.1 Rous sarcoma virus, complete genome",0,5.52362323691e-05
0.333333333333,"NC_001408.1 Avian leukosis virus - RSA, complete genome",0,2.92427112542e-05
0.08,"NC_015116.1 Avian leukemia virus isolate SCDY1, complete genome",0,9.74757041807e-06
0.0320381731425,"NC_002577.1 Gallid herpesvirus 3, complete genome",0,7.63559682749e-05
